{
  "apiVersion": "samples.openbkn.ai/v1beta1",
  "kind": "SampleCatalog",
  "metadata": {
    "sourceId": "openbkn-official",
    "revision": "catalog-000013",
    "sequence": 13,
    "channel": "stable",
    "publishedAt": "2026-10-14T01:42:54Z"
  },
  "spec": {
    "entries": [
      {
        "sampleId": "supply-chain",
        "version": "0.1.1",
        "displayName": "供应链",
        "summary": "用脱敏的订单、库存、BOM 和供应数据体验交付判断。",
        "publishedAt": "2026-10-10T05:13:11Z",
        "releaseStatus": "withdrawn",
        "releaseNotes": {
          "defaultLocale": "zh-CN",
          "summary": "供应链固定制品候选版本 0.1.1",
          "documents": [
            {
              "locale": "en-US",
              "url": "https://raw.githubusercontent.com/openbkn-ai/bkn-samples/0840b99b0dc5ad2303733c72ec460f9de3ca0195/samples/supply_ontology_hand/releases/0.1.1/release-notes.en-US.md",
              "digest": "sha256:1d39faea8017adc157993a81ee552cf14973da436c6e186d516ddff443f99ed2"
            },
            {
              "locale": "zh-CN",
              "url": "https://raw.githubusercontent.com/openbkn-ai/bkn-samples/0840b99b0dc5ad2303733c72ec460f9de3ca0195/samples/supply_ontology_hand/releases/0.1.1/release-notes.zh-CN.md",
              "digest": "sha256:eafc65369d3a432fe33c1ad4acd21ae55f26bc252fee6a33da4391a5a5384ee6"
            }
          ]
        },
        "manifest": {
          "url": "https://raw.githubusercontent.com/openbkn-ai/bkn-samples/0840b99b0dc5ad2303733c72ec460f9de3ca0195/samples/supply_ontology_hand/releases/0.1.1/sample.json",
          "digest": "sha256:722a27c7c6646c644cec48d9111a7763706a36b5c9910a7bad7852ca5b42c139"
        },
        "requires": {
          "platformVersion": ">=0.2.0 <0.3.0",
          "capabilities": [
            "vega.catalog",
            "knowledge-network.import.kn-json",
            "execution.function",
            "execution.skill"
          ],
          "architectures": [
            "amd64",
            "arm64"
          ],
          "requiredExtensions": [],
          "installationProfiles": [
            "openbkn.ai/sample-install.v1"
          ]
        },
        "verification": {
          "url": "https://raw.githubusercontent.com/openbkn-ai/bkn-samples/0840b99b0dc5ad2303733c72ec460f9de3ca0195/samples/supply_ontology_hand/releases/0.1.1/verification.json",
          "digest": "sha256:3843437dde4d2561897377dc71f76a4bbe3daeefde97d92eb38b6b8058ccdd7b"
        },
        "withdrawalReason": "Superseded development release; only the latest verified release remains available for installation."
      },
      {
        "sampleId": "supply-chain",
        "version": "0.1.2",
        "displayName": "供应链",
        "summary": "用脱敏的订单、库存、BOM 和供应数据体验交付判断。",
        "publishedAt": "2026-10-10T09:00:00Z",
        "releaseStatus": "withdrawn",
        "releaseNotes": {
          "defaultLocale": "zh-CN",
          "summary": "新增交付风险汇总 Skill，并保持供应链安装与验收链路可复现。",
          "documents": [
            {
              "locale": "en-US",
              "url": "https://raw.githubusercontent.com/openbkn-ai/bkn-samples/3c4dc840f638982bdfc71bf2fb5283977ea3ffce/samples/supply_ontology_hand/releases/0.1.2/release-notes.en-US.md",
              "digest": "sha256:5b90b3cb722b9676a41465c72db46a46df93a451c5eac57f426bebb41d3cacd5"
            },
            {
              "locale": "zh-CN",
              "url": "https://raw.githubusercontent.com/openbkn-ai/bkn-samples/3c4dc840f638982bdfc71bf2fb5283977ea3ffce/samples/supply_ontology_hand/releases/0.1.2/release-notes.zh-CN.md",
              "digest": "sha256:a443df28d6c4fb79412aae03f6b03a36a82eb774b6f8fa3a35a92ceb8aea1f18"
            }
          ]
        },
        "manifest": {
          "url": "https://raw.githubusercontent.com/openbkn-ai/bkn-samples/3c4dc840f638982bdfc71bf2fb5283977ea3ffce/samples/supply_ontology_hand/releases/0.1.2/sample.json",
          "digest": "sha256:d56affea72e665ab19bd59b671e6db24b830107facf38366e352af43a1e51e1f"
        },
        "requires": {
          "platformVersion": ">=0.2.0 <0.3.0",
          "capabilities": [
            "vega.catalog",
            "knowledge-network.import.kn-json",
            "execution.function",
            "execution.skill"
          ],
          "architectures": [
            "amd64",
            "arm64"
          ],
          "requiredExtensions": [],
          "installationProfiles": [
            "openbkn.ai/sample-install.v1"
          ]
        },
        "verification": {
          "url": "https://raw.githubusercontent.com/openbkn-ai/bkn-samples/3c4dc840f638982bdfc71bf2fb5283977ea3ffce/samples/supply_ontology_hand/releases/0.1.2/verification.json",
          "digest": "sha256:9db31b704b91ff193cf7bce5b32e4e843370eaa6c4dc125f73264aa53fe27c24"
        },
        "withdrawalReason": "Superseded development release; only the latest verified release remains available for installation."
      },
      {
        "sampleId": "world-cup",
        "version": "0.1.0",
        "displayName": "世界杯",
        "summary": "用公开的世界杯数据体验跨表查询和已发布的 SQL 工具。",
        "publishedAt": "2026-10-10T15:46:31Z",
        "releaseStatus": "withdrawn",
        "releaseNotes": {
          "defaultLocale": "zh-CN",
          "summary": "World Cup native BKN and embedded data release 0.1.0",
          "documents": [
            {
              "locale": "en-US",
              "url": "https://raw.githubusercontent.com/openbkn-ai/bkn-samples/bad4b049887ac15db543fb7eae011a299e2e692d/samples/world-cup/releases/0.1.0/release-notes.en-US.md",
              "digest": "sha256:66fb52a2da19bc5fc12f3d76705275c78d936112c6f9a5810b782faec65254a6"
            },
            {
              "locale": "zh-CN",
              "url": "https://raw.githubusercontent.com/openbkn-ai/bkn-samples/bad4b049887ac15db543fb7eae011a299e2e692d/samples/world-cup/releases/0.1.0/release-notes.zh-CN.md",
              "digest": "sha256:de3154274af1d5bfb03b01fadb3199713b7533e0bc768002649957fcfeaa14bb"
            }
          ]
        },
        "manifest": {
          "url": "https://raw.githubusercontent.com/openbkn-ai/bkn-samples/bad4b049887ac15db543fb7eae011a299e2e692d/samples/world-cup/releases/0.1.0/sample.json",
          "digest": "sha256:0e3332647902189ddccc8fee818861429c46fd042242f79000ebd49585e8a639"
        },
        "requires": {
          "platformVersion": ">=0.2.0 <0.3.0",
          "capabilities": [
            "vega.catalog",
            "knowledge-network.import.bkn-directory",
            "execution.function"
          ],
          "architectures": [
            "amd64",
            "arm64"
          ],
          "requiredExtensions": [],
          "installationProfiles": [
            "openbkn.ai/sample-install.v1"
          ]
        },
        "verification": {
          "url": "https://raw.githubusercontent.com/openbkn-ai/bkn-samples/bad4b049887ac15db543fb7eae011a299e2e692d/samples/world-cup/releases/0.1.0/verification.json",
          "digest": "sha256:b8ef0120a3cbe0abb5fb736922c3b86203e22f5bff24a25fa2468098d4c0c15e"
        },
        "withdrawalReason": "Superseded development release; only the latest verified release remains available for installation."
      },
      {
        "sampleId": "world-cup",
        "version": "0.1.1",
        "displayName": "世界杯",
        "summary": "用公开的世界杯数据体验跨表查询和已发布的 SQL 工具。",
        "publishedAt": "2026-10-11T01:30:00Z",
        "releaseStatus": "withdrawn",
        "releaseNotes": {
          "defaultLocale": "zh-CN",
          "summary": "World Cup native BKN and embedded data release 0.1.1",
          "documents": [
            {
              "locale": "en-US",
              "url": "https://raw.githubusercontent.com/openbkn-ai/bkn-samples/5bb43363aaa221507c2585b1a04d68b8b8e63b28/samples/world-cup/releases/0.1.1/release-notes.en-US.md",
              "digest": "sha256:b189700307d6b3a61eebfbf237dd33318e9e6cf32e1a330028c118d6366fa09e"
            },
            {
              "locale": "zh-CN",
              "url": "https://raw.githubusercontent.com/openbkn-ai/bkn-samples/5bb43363aaa221507c2585b1a04d68b8b8e63b28/samples/world-cup/releases/0.1.1/release-notes.zh-CN.md",
              "digest": "sha256:944590afed51f6d043352a0ffa92a388a970bcc69fd0a5c37996a9b849c5d86d"
            }
          ]
        },
        "manifest": {
          "url": "https://raw.githubusercontent.com/openbkn-ai/bkn-samples/5bb43363aaa221507c2585b1a04d68b8b8e63b28/samples/world-cup/releases/0.1.1/sample.json",
          "digest": "sha256:8e1ad4ed90bbf581f9be26c8d0103e5d78ddaecf9fc59c3a6b49893a82033cae"
        },
        "requires": {
          "platformVersion": ">=0.2.0 <0.3.0",
          "capabilities": [
            "vega.catalog",
            "knowledge-network.import.bkn-directory",
            "execution.function"
          ],
          "architectures": [
            "amd64",
            "arm64"
          ],
          "requiredExtensions": [],
          "installationProfiles": [
            "openbkn.ai/sample-install.v1"
          ]
        },
        "verification": {
          "url": "https://raw.githubusercontent.com/openbkn-ai/bkn-samples/55e09d89dd23a15d66a0a81397ad8e858fc570c8/samples/world-cup/releases/0.1.1/verification.json",
          "digest": "sha256:85ae2202292f6fb5169d2d6ad7054835388c09530d1821eb9ce94383e288ca04"
        },
        "withdrawalReason": "Superseded development release; only the latest verified release remains available for installation."
      },
      {
        "sampleId": "supply-chain",
        "version": "0.1.3",
        "displayName": "供应链",
        "summary": "用脱敏的订单、库存、BOM 和供应数据体验交付判断。",
        "publishedAt": "2026-10-11T05:04:51Z",
        "releaseStatus": "withdrawn",
        "releaseNotes": {
          "defaultLocale": "zh-CN",
          "summary": "供应链 0.1.3：指标导入、绑定与实际计算校验",
          "documents": [
            {
              "locale": "en-US",